<?xml version="1.0" encoding="UTF-8"?>
<dataSourceConfiguration
	xmlns="http://xmlns.data.generator.com/configuration/v1" xmlns:xsi="http://www.w3.org/2001/XMLSchema-instance"
	xsi:schemaLocation="http://xmlns.data.generator.com/configuration/v1 data-generator-configuration.xsd ">
	<id>idvalue0</id>
	<uniqueId>token</uniqueId>
	<dateGenerated>2001-12-31T12:00:00</dateGenerated>
	<lastModified>2001-12-31T12:00:00</lastModified>
	<dateCreated>2001-12-31T12:00:00</dateCreated>
	<mainDataSource>
		<name>token</name>
		<entity>
			<id>idvalue1</id>
			<uniqueId>token</uniqueId>
			<dateGenerated>2001-12-31T12:00:00</dateGenerated>
			<lastModified>2001-12-31T12:00:00</lastModified>
			<dateCreated>2001-12-31T12:00:00</dateCreated>
			<name>token</name>
			<label>token</label>
			<field>
				<id>idvalue2</id>
				<uniqueId>token</uniqueId>
				<dateGenerated>2001-12-31T12:00:00</dateGenerated>
				<lastModified>2001-12-31T12:00:00</lastModified>
				<dateCreated>2001-12-31T12:00:00</dateCreated>
				<name>token</name>
				<label>token</label>
				<type>token</type>
				<length>0.0</length>
				<maxLength>0.0</maxLength>
				<precision>0</precision>
				<scale>0</scale>
				<digits>0.0</digits>
				<byteLength>0.0</byteLength>
				<calculatedFormula>token</calculatedFormula>
				<controllerName>token</controllerName>
				<defaultValue>token</defaultValue>
				<soapType>token</soapType>
				<unique>true</unique>
				<nameField>true</nameField>
				<nullable>true</nullable>
				<custom>true</custom>
				<updatable>true</updatable>
				<filterable>true</filterable>
				<autoNumber>true</autoNumber>
				<idLookup>true</idLookup>
				<externalId>true</externalId>
				<htmlFormatted>true</htmlFormatted>
				<computedValue>true</computedValue>
				<caseSensitive>true</caseSensitive>
				<namePointing>true</namePointing>
				<pickList>true</pickList>
				<restrictedPickList>true</restrictedPickList>
				<sortable>true</sortable>
				<groupable>true</groupable>
				<inlineHelpText>token</inlineHelpText>
				<relationshipOrder>0.0</relationshipOrder>
				<calculated>true</calculated>
				<createable>true</createable>
				<hasDependentPickLists>true</hasDependentPickLists>
				<usedInReports>true</usedInReports>
				<usedInCharts>true</usedInCharts>
				<writeRequiresMasterRead>true</writeRequiresMasterRead>
				<defaultedOnCreate>true</defaultedOnCreate>
				<deprecatedAndHidden>true</deprecatedAndHidden>
				<relationship>token</relationship>
				<enitityUniqueId>token</enitityUniqueId>
				<referenceTo>token</referenceTo>
				<entity>
					<refId>idvalue0</refId>
				</entity>
				<picklistItems>
					<dataSource>token</dataSource>
					<active>true</active>
					<defaultValue>true</defaultValue>
					<label>token</label>
					<validFor>0</validFor>
					<value>token</value>
				</picklistItems>
				<dataSourceFieldName>
					<fieldName>token</fieldName>
					<fieldType>token</fieldType>
				</dataSourceFieldName>
			</field>
		</entity>
	</mainDataSource>
	<additionalDataSource>
		<name>token</name>
	</additionalDataSource>
</dataSourceConfiguration>
